{"schemaVersion":"signal-public-summary/1","status":"UNAVAILABLE","inputSnapshot":null,"inputSnapshotHash":null,"ruleVersion":"signal-engine-v0.1-draft.1","engineVersion":"offline-prototype/0.1.2","evidenceThrough":null,"factorCount":7,"validFactorCount":null,"evidenceQuality":null,"thresholdSensitiveFactorIds":[],"brief":null,"conclusions":null,"factors":[]}
